{
 "accepted_blueprint_role": {
  "advances_plan": "Kess turns single tutors into complete Oracle wins and makes the Gifts/Intuition piles deterministic.",
  "confidence": "high",
  "evidence_class": "strategic_judgment",
  "honest_note": "Her permission is once per your own turn at normal timing (M1 kess-01), so it doesn't help on opponents' turns. Oracle + Consultation and the Breach lines still win without her, just less efficiently.",
  "level": "central"
 },
 "authority": {
  "can_decide": false,
  "note": "Structural commander-reference counts are a counterfactual prior only; they cannot decide deck changes or commander value."
 },
 "blueprint_routes": {
  "engines": [
   {
    "commander_explicit": true,
    "commander_refs": [
     "Kess, Dissident Mage"
    ],
    "id": "graveyard-replay",
    "online_condition_mentions_commander": false
   },
   {
    "commander_explicit": false,
    "commander_refs": [],
    "id": "fast-mana-tutors",
    "online_condition_mentions_commander": false
   }
  ],
  "packages": [
   {
    "commander_explicit": false,
    "commander_refs": [],
    "id": "pkg:oracle-piles",
    "min_count": 6,
    "required": true
   },
   {
    "commander_explicit": false,
    "commander_refs": [],
    "id": "pkg:yard-stock",
    "min_count": 5,
    "required": true
   },
   {
    "commander_explicit": false,
    "commander_refs": [],
    "id": "pkg:free-interaction",
    "min_count": 8,
    "required": true
   }
  ],
  "wins": [
   {
    "commander_explicit": true,
    "commander_refs": [
     "Kess, Dissident Mage"
    ],
    "confidence": "verified",
    "evidence_class": "fact",
    "id": "kess-oracle",
    "kind": "combo"
   },
   {
    "commander_explicit": false,
    "commander_refs": [],
    "confidence": "verified",
    "evidence_class": "fact",
    "id": "breach-station",
    "kind": "combo"
   },
   {
    "commander_explicit": false,
    "commander_refs": [],
    "confidence": "verified",
    "evidence_class": "fact",
    "id": "breach-led",
    "kind": "combo"
   }
  ]
 },
 "canonical_hash": "lh1:d89d5778424e5aa61244cd1aea7aa6967ad678860c59cafbb62e14abbe6dfa9b",
 "combo_routes": [
  {
   "blueprint_commander_support": [
    "Kess, Dissident Mage"
   ],
   "cards": [
    "Tainted Pact",
    "Thassa's Oracle"
   ],
   "direct_commander_pieces": [],
   "id": "1295-3093",
   "mode": "blueprint_supported",
   "structural_hint": "commander_supported_combo"
  },
  {
   "blueprint_commander_support": [],
   "cards": [
    "Underworld Breach",
    "Grinding Station"
   ],
   "direct_commander_pieces": [],
   "id": "1368-3698--44",
   "mode": "commander_independent",
   "structural_hint": "commander_independent_power_package"
  },
  {
   "blueprint_commander_support": [
    "Kess, Dissident Mage"
   ],
   "cards": [
    "Demonic Consultation",
    "Thassa's Oracle"
   ],
   "direct_commander_pieces": [],
   "id": "742-1295",
   "mode": "blueprint_supported",
   "structural_hint": "commander_supported_combo"
  },
  {
   "blueprint_commander_support": [],
   "cards": [
    "Underworld Breach",
    "Lotus Petal",
    "Brain Freeze"
   ],
   "direct_commander_pieces": [],
   "id": "1368-1414-4856",
   "mode": "commander_independent",
   "structural_hint": "commander_independent_power_package"
  },
  {
   "blueprint_commander_support": [],
   "cards": [
    "Underworld Breach",
    "Lion's Eye Diamond",
    "Wheel of Fortune"
   ],
   "direct_commander_pieces": [],
   "id": "1368-2706-3518",
   "mode": "commander_independent",
   "structural_hint": "commander_independent_power_package"
  },
  {
   "blueprint_commander_support": [],
   "cards": [
    "Underworld Breach",
    "Lion's Eye Diamond",
    "Brain Freeze"
   ],
   "direct_commander_pieces": [],
   "id": "1368-3518-4856",
   "mode": "commander_independent",
   "structural_hint": "commander_independent_power_package"
  }
 ],
 "commanders": [
  "Kess, Dissident Mage"
 ],
 "confidence": "moderate",
 "counterfactual_questions": [
  "Which declared wins disappear or change when the commander is unavailable?",
  "Which declared engines/packages explicitly require the commander?",
  "Which Spellbook lines remain structurally independent?",
  "How much dynamic card economy, action efficiency, assembly speed and recovery actually changes? (deferred to later Step D batches)"
 ],
 "deck_id": "Kess__Dissident_Mage",
 "evidence_class": "derived_metric",
 "limitations": [
  "Exact-name/Blueprint support is structural evidence, not a complete rules-interaction detector.",
  "A route without an explicit commander reference may still gain substantial value from the commander in play.",
  "A route with an explicit commander reference may have redundant alternate routes not captured by a single Blueprint field.",
  "Counts are intentionally not combined into a synthetic commander-value score.",
  "Dynamic effects on cards drawn, meaningful actions, mana spent, combo timing and recovery require the Step D counterfactual simulator layer."
 ],
 "schema_version": 1,
 "slug": "kess-dissident-mage",
 "status": "provisional_evidence",
 "summary": {
  "blueprint_wins": 3,
  "blueprint_wins_explicit_commander": 1,
  "blueprint_wins_structurally_independent": 2,
  "combo_blueprint_supported": 2,
  "combo_commander_independent": 4,
  "combo_direct_commander_piece": 0,
  "engines": 2,
  "engines_explicit_commander": 1,
  "required_packages": 3,
  "required_packages_explicit_commander": 0,
  "spellbook_lines": 6
 }
}
